{
  "grantha_id": "brihadaranyaka-upanishad",
  "part_num": 14,
  "prefatory_material": [],
  "passages": [
    {
      "ref": "8.3.4",
      "passage_type": "main",
      "content": {
        "sanskrit": {
          "devanagari": "बृहदारण्यकोपनिषत् अष्टमोऽध्यायः अथैनमभिमृशति, भ्रमदसि ज्वलदसि पूर्णमसि प्रस्तभ्धमस्येकसभमसि हिङ् कृतमसि हिङ् क्रियमाणमसि उद्गीथमसि उद्गीयमानमसि श्रावितमसि प्रत्याश्रावितमसि आद्रे संदीप्तमसि विभूरसि प्रभूरस्थानमसि ज्योतिरसि निधनमसि संवर्गोऽसीति ॥ ४ ॥",
          "roman": null,
          "kannada": null
        },
        "english_translation": null
      }
    },
    {
      "ref": "8.3.5",
      "passage_type": "main",
      "content": {
        "sanskrit": {
          "devanagari": "अथैनमुद्यच्छति, आमँस्यामँहितेमहि स हि राजेशानोऽधिपतिः स मां राजेशानोऽधिपतिं करोत्विति ॥ ५ ॥",
          "roman": null,
          "kannada": null
        },
        "english_translation": null
      }
    },
    {
      "ref": "8.3.6",
      "passage_type": "main",
      "content": {
        "sanskrit": {
          "devanagari": "अथैनमाचामति, तत्सवितुर्वरेण्यम् । मधुवाता ऋतायते मधुक्षरन्ति सिन्धवः माध्वीर्नः सन्त्वोषधीः भूःस्वाहा । भर्गो देवस्य धीमहि, मधुनक्तमुतोषसो मधुमत् पाथिर्वं रजः मधु द्यौरस्तु नःपिता भुवः स्वाहा । धियो यो नः प्रचोदयात् । मधुमान्नो वनस्पतिर्मधुमाँ अस्तु सूर्यः माध्वीर्गावो भवन्तु नः, स्वः स्वाहेति । सर्वाञ्च सावित्रीमन्वाह सर्वाश्च मधुमतीः अहमेवेदँ सर्वं भूयासम्; भूर्भुवस्स्वः स्वाहेत्यन्तत आचम्य पाणी प्रक्षाल्य जघनेनाग्निं प्राक्छिराः संविशति ॥ ६ ॥ प्रातरादित्यमुपतिष्ठते, दिशामेकपुण्डरीकमस्यहं मनुष्याणामेकपुण्डरीकं भूयासमिति । यथेतमेत्य जघनेनाग्निमासीनो वँश जपति ॥ ६ ॥",
          "roman": null,
          "kannada": null
        },
        "english_translation": null
      }
    },
    {
      "ref": "8.3.7",
      "passage_type": "main",
      "content": {
        "sanskrit": {
          "devanagari": "तँ हैतमुद्दालक आरुणिर्वाजसनेयाय याज्ञवल्क्याय अन्तेवासिन उक्त्वोवाच - अपि य एनँ शुष्के स्थाणौ निषिञ्चेत्, जायेरच्छाखाः, प्ररोहेयुः पलाशानीति ॥ ७ ॥",
          "roman": null,
          "kannada": null
        },
        "english_translation": null
      }
    },
    {
      "ref": "8.3.8",
      "passage_type": "main",
      "content": {
        "sanskrit": {
          "devanagari": "एतमु हैव वाजसनेयो याज्ञवल्क्यो मधुकाय पैङ्ग्यायान्तेवासिन उक्त्वोवाच - अपि य एनँ शुष्के स्थाणौ निषेञ्चेत् जायेरञ्छाखाः प्ररोहेयुः पलाशानीति ॥ ८ ॥",
          "roman": null,
          "kannada": null
        },
        "english_translation": null
      }
    },
    {
      "ref": "8.3.9",
      "passage_type": "main",
      "content": {
        "sanskrit": {
          "devanagari": "एतमु हैव मधुकः पैङ्ग्यश्चूलाय भागवित्तयेऽन्तेवासिन उक्त्वोवाच अपि य एवँ शुष्के स्थाणौ निषिञ्चेत्, जायेरन् शाखाः, प्ररोहेयुः पलाशानीति ॥ ९ ॥",
          "roman": null,
          "kannada": null
        },
        "english_translation": null
      }
    },
    {
      "ref": "8.3.10",
      "passage_type": "main",
      "content": {
        "sanskrit": {
          "devanagari": "एतमु हैव चूलो भागवित्तिर्जानकस्य आयस्थूणायान्ते वासिन उक्त्वोवाच - अपि य एनँ शुष्के स्थाणौ निषिञ्चेत् जायेरन् शाखाः, प्ररोहेयुः पलाशानीति ॥ १० ॥",
          "roman": null,
          "kannada": null
        },
        "english_translation": null
      }
    },
    {
      "ref": "8.3.11",
      "passage_type": "main",
      "content": {
        "sanskrit": {
          "devanagari": "एतमु हैव जानकिरायस्थूणः सत्यकामाय जाबालाय अन्तेवासिने उक्त्वोवाच - अपि य एनँ शुष्के स्थाणौ निषिञ्चेत् । जायेरञ्छाखाः, प्ररोहेयुः पलाशानीति ॥ ११ ॥",
          "roman": null,
          "kannada": null
        },
        "english_translation": null
      }
    },
    {
      "ref": "8.3.12",
      "passage_type": "main",
      "content": {
        "sanskrit": {
          "devanagari": "एतमु हैव सत्यकामो जाबालोऽन्तेवासिभ्य उक्त्वा उवाच अपि य एनँ शुष्के स्थाणौ निषिञ्चेत्, जायेरन् शाखाः प्ररोहेयुः पलाशानीति । तमेतं नापुत्राय वाऽनन्तेवासिने वा ब्रूयात् ॥ १२ ॥",
          "roman": null,
          "kannada": null
        },
        "english_translation": null
      }
    },
    {
      "ref": "8.3.13",
      "passage_type": "main",
      "content": {
        "sanskrit": {
          "devanagari": "चतुरौदुम्बरो भवति, औदुम्बरः स्रुव औदुम्बरः चमस औदुम्बर इध्म औदुम्बर्या वुपमन्थानौ । दशग्राम्याणि धान्यानि भवन्ति, व्रीहियवास्तिलमाषा अणुप्रियङ्गवो गोधूमाश्च मसूराश्च खल्वाश्च खलकुलाश्च । तान् पिष्ट्वा दधनि मधुनि घृत उपसिञ्चति । आज्यस्य जुहोति ॥ १३ ॥",
          "roman": null,
          "kannada": null
        },
        "english_translation": null
      }
    },
    {
      "ref": "8.4.1",
      "passage_type": "main",
      "content": {
        "sanskrit": {
          "devanagari": "॥ इति अष्टमाध्याये तृतीयब्राह्मण प्रकाशिका ॥ चतुर्थं ब्राह्मणम् - पुत्रमन्थकर्मब्राह्मणम् एषां भूतानां पृथिवी रसः, पृथिव्या आपोऽपामोषधय ओषधीनां पुष्पाणि, पुष्पाणां फलानि, फलानां पुरुषः, पुरुषस्य रेतः ॥१॥",
          "roman": null,
          "kannada": null
        },
        "english_translation": null
      }
    },
    {
      "ref": "8.4.2",
      "passage_type": "main",
      "content": {
        "sanskrit": {
          "devanagari": "स ह प्रजापतिरीक्षाञ्चक्रे हन्तास्मै प्रतिष्ठां कल्पयानीति । स स्त्रियँ ससृजे । ताँ सृष्ट्वाऽध उपास्त । तस्मात् स्त्रियमध उपासते । स एतं प्राञ्चं ग्रावाणमात्मन एव समुदपारयत् । तेनैनामभ्यसृजत् ॥ २ ॥",
          "roman": null,
          "kannada": null
        },
        "english_translation": null
      }
    },
    {
      "ref": "8.4.3",
      "passage_type": "main",
      "content": {
        "sanskrit": {
          "devanagari": "तस्या वेदिरुपस्थो लोमानि बर्हिश्चर्माधिषवणे समिद्धो मध्यतःस्थौ मुष्कौ । स यावान् ह वै वाजपेयेन यजमानस्य लोको भवति, तावानस्य लोको भवति, य एवं विद्वानधोपहासं चरति; आसाँ स्त्रीणाँ सुकृतं वृङ्क्ते । अथ य इदमविद्वानधोपहासं चरति, अस्य स्त्रियः सुकृतं वृञ्जते ॥ ३ ॥",
          "roman": null,
          "kannada": null
        },
        "english_translation": null
      }
    },
    {
      "ref": "8.4.4",
      "passage_type": "main",
      "content": {
        "sanskrit": {
          "devanagari": "एतद्ध स्म वै तद् विद्वानुद्दालक आरुणिराह, एतद्ध स्म वै तद् विद्वान्नाको मौद्गल्य आह, एतद्ध स्म वै तद् विद्वान् कुमारहारित आह - बहवो मर्या ब्राह्मणायना निरिन्द्रिया विसुकृतो अस्माल्लोकात् प्रयन्ति, य इदमविद्वाँसोऽधोपहासं चरन्तीति । बहु वा इदँ सुप्तस्य वा जाग्रतो वा रेतः स्कन्दति ॥ ४ ॥",
          "roman": null,
          "kannada": null
        },
        "english_translation": null
      }
    },
    {
      "ref": "8.4.5",
      "passage_type": "main",
      "content": {
        "sanskrit": {
          "devanagari": "तदभिमृशेदनु वा मन्त्रयेत यन्मेऽद्य रेतः पृथिवीम् अस्कान्त्सीद्यदोषधीरप्यसरत् यदप इदमहं तद्रेत आददे पुनर्मामैत्विन्द्रियं पुनस्तेजः पुनर्भगः पुनरग्निर्धिष्ण्या यथास्थानं कल्पन्तामित्यनामिकाङ् गुष्ठाभ्यामादायान्तरेण स्तनौ वा भ्रुवौ वा निमृज्यात् ॥ ५ ॥",
          "roman": null,
          "kannada": null
        },
        "english_translation": null
      }
    },
    {
      "ref": "8.4.6",
      "passage_type": "main",
      "content": {
        "sanskrit": {
          "devanagari": "अथ यद्युदक आत्मानं परिपश्येत्, तदभिमन्त्रयेत, मयि तेज इन्द्रियं यशो द्रविणँ सुकृतम् इति । श्रीर्हवा एषा स्त्रीणाम्, यन्मलोद्वासाः । तस्मान्मलोद्वाससं यशस्विनीमभिक्रम्योपमन्त्रयेत ॥ ६ ॥",
          "roman": null,
          "kannada": null
        },
        "english_translation": null
      }
    },
    {
      "ref": "8.4.7",
      "passage_type": "main",
      "content": {
        "sanskrit": {
          "devanagari": "सा चैदस्मै न दद्यात्, काममेनामवक्रीणीयात्, सा चैदस्मै नैव दद्यात्, काममेनां यष्ट्या वा पाणिना वोपहत्यातिक्रामेत, इन्द्रियेण ते यशसा यश आदद इति; अयशा एव भवति ॥७॥",
          "roman": null,
          "kannada": null
        },
        "english_translation": null
      }
    },
    {
      "ref": "8.4.8",
      "passage_type": "main",
      "content": {
        "sanskrit": {
          "devanagari": "सा चेदस्मै दद्यात् - इन्द्रियेण ते यशसा यश आदधामि इति; यशस्विनावेव भवतः ॥८॥",
          "roman": null,
          "kannada": null
        },
        "english_translation": null
      }
    },
    {
      "ref": "8.4.9",
      "passage_type": "main",
      "content": {
        "sanskrit": {
          "devanagari": "स यामिच्छेत्, कामयत मेति, तस्यामर्थं निष्ठाय मुखेन मुखेँ सन्धायोपस्थम् अस्या अभिमृश्य जपेत्, अङ्गादङ्गात् सम्भवसि हृदयादधि जायसे । स त्वमङ्गकषायोऽसि दिग्धविद्धामिव मादयेमाममूं मयीति ॥ ९ ॥",
          "roman": null,
          "kannada": null
        },
        "english_translation": null
      }
    },
    {
      "ref": "8.4.10",
      "passage_type": "main",
      "content": {
        "sanskrit": {
          "devanagari": "अथ यामिच्छेत् न गर्भं दधीतेति, तस्यामर्थं निष्ठाय मुखेन मुखँ सन्धायाभिप्राण्यापान्यात्, इन्द्रियेण ते रेतसा रेत आदद इति । अरेता एव भवति ॥ १० ॥",
          "roman": null,
          "kannada": null
        },
        "english_translation": null
      }
    },
    {
      "ref": "8.4.11",
      "passage_type": "main",
      "content": {
        "sanskrit": {
          "devanagari": "अथ यामिच्छेत्, दधीतेति, तस्यामर्थं निष्ठाय मुखेन मुखँ सन्धायापान्याभि- प्राण्यात् इन्द्रियेण ते रेतसा रेत आदधामीति; गर्भिण्येव भवति ॥ ११ ॥",
          "roman": null,
          "kannada": null
        },
        "english_translation": null
      }
    },
    {
      "ref": "8.4.12",
      "passage_type": "main",
      "content": {
        "sanskrit": {
          "devanagari": "अथ यस्य जायायै जारः स्यात् - तञ्चेद् द्विष्यात्, आमपात्रेऽग्निमुपसमाधाय प्रतिलोमँ शरबर्हिः स्तीर्त्वा तस्मिन्नेताः शरभृष्टीः प्रतिलोमाः सर्पिषाऽक्ता जुहुयात् - मम समिद्धेऽहौषीः, प्राणापानौ त आददे; असाविति । मम समिद्धेऽहौषीः, पुत्र- पशूँस्त आददे; असाविति । मम समिद्धेऽहौषीः, इष्टासुकृते त आददे; असाविति । मम समिद्धेऽहौषीः आशापराकाशौ त आददेऽसाविति स वा एष निरिन्द्रियो विसुकृदस्माल्लोकात्प्रैति, यमेवं विद्वान् ब्राह्मणः शपति ॥ तस्मादेवँविच्छ्रोत्रियस्य दारेण नोपहासमिच्छेदुत ह्येवंवित् परो भवति ॥ १२ ॥",
          "roman": null,
          "kannada": null
        },